order_id,customer_id,date,nearest_warehouse,shopping_cart,order_price,delivery_charges,customer_lat,customer_long,coupon_discount,order_total,season,is_expedited_delivery,distance_to_nearest_warehouse,latest_customer_review,is_happy_customer
ORD000594,ID0493873196,2019-05-24,Nickolson,"[('Toshika 750', 2), ('Universe Note', 2), ('Lucent 330S', 1)]",16770.0,53.05,-37.8055575,144.9723686,5,15984.55,Autumn,False,1.4723,quality of screen display is lacking and the reason i returned the tablet. for adult users i cannot recommend.,False
ORD442121,ID6167191174,2019-06-20,Nickolson,"[('Olivia x460', 2), ('pearTV', 1), ('iAssist Line', 1), ('Lucent 330S', 1)]",12215.0,50.99,-37.8175175,144.95917680000005,25,9212.24,Winter,False,0.9201,not new not new,False
ORD037826,ID0247417839,2019-03-31,Nickolson,"[('Lucent 330S', 1), ('iAssist Line', 1)]",3455.0,77.6,-37.818120799999996,144.9693491,10,3187.1,Autumn,True,0.0557,they are a little pricey but are a good phone that will last. was hoping to use music for ring tones but didnt work the way an android works but by far a better security dydtem on an alcon.,True
ORD118396,ID0575397943,2019-08-11,Nickolson,"[('Alcon 10', 2), ('Lucent 330S', 2), ('Thunder line', 1), ('Olivia x460', 2)]",24990.0,68.51,-37.82114960000001,144.9841856,0,25058.51,Winter,False,1.3179,great buy no problems. the phone was fully unlocked.,True
ORD167953,ID0305106874,2019-07-10,Thompson,"[('Candle Inferno', 2), ('Olivia x460', 2), ('iAssist Line', 2)]",7760.0,73.14,-37.8091594,144.94407030000005,0,7833.14,Winter,True,0.4717,connect to the world kids love them,True
ORD454065,ID3775020762,2019-03-24,Bakers,"[('iStream', 2), ('Candle Inferno', 2)]",1160.0,79.36,-37.8073967,144.98411299999995,25,949.36,Autumn,True,1.0198,five stars awesome phone. unit is in great condition.,True
ORD451348,ID0781000951,2019-05-10,Thompson,"[('Olivia x460', 1), ('Alcon 10', 2)]",19125.0,65.28,-37.8049748,144.9493303,0,19190.28,Autumn,False,0.8797,excellent quality got the phone in excellent conditions like the phone no issues at all,True
ORD212035,ID0411688746,2019-04-09,Nickolson,"[('Candle Inferno', 1), ('Thunder line', 1), ('pearTV', 2), ('Toshika 750', 2)]",23870.0,62.19864914874107,-37.8209409,144.969902,0,23932.35,Autumn,True,0.263,did not operate long phone lasted 3 months and died.,False
ORD432570,ID0298046578,2019-08-02,Nickolson,"[('Olivia x460', 2), ('Thunder line', 1)]",4630.0,59.25863489033293,-37.82083770000001,144.9666228,15,3997.58,Winter,False,0.3586,"great value, really nice smartphone this is a great phone and an excellent value. well built, nice looking, with a lot of bang for the buck. i especially like the camera and the display.",True
ORD344883,ID0387153067,2019-03-15,Thompson,"[('Toshika 750', 2), ('Lucent 330S', 2)]",11100.0,81.97,-37.8021045,144.9498601,0,11181.97,Autumn,True,1.2018,super the phone is great. i'm just not sure i need all this stuff. i don't understand the word minimum requirement for reviews. it makes no sense.,True
ORD384243,ID0131247470,2019-08-28,Nickolson,"[('pearTV', 2), ('Lucent 330S', 1), ('Toshika 750', 1), ('Thunder line', 1)]",20350.0,49.84,-37.8142812,144.9610188,0,20399.84,Winter,False,0.8908,no headphone jack they forgot to put in a headphone jack. remember when oneplus made fun of phones without a headphone jack? i do because it wasn't that long ago and still makes no sense. i don't always want to wait for my headphones to charge before using them.,False
ORD077432,ID0122752809,2019-10-09,Thompson,"[('Toshika 750', 1), ('iStream', 1)]",4470.0,75.18,-37.815026700000004,144.9412471,25,3427.68,Spring,False,0.5751,take a look youtube how to use this phone work perfect almost like new thanks.,True
ORD174029,ID2481930364,2019-01-17,Bakers,"[('Candle Inferno', 2), ('iStream', 2), ('iAssist Line', 2)]",5610.0,56.83,-37.80551060000001,144.9986564,25,4264.33,Summer,False,0.5831,"check your network before you buy. in the u.s., sprint, verizon and u.s. cellular use cdma. at&t and t-mobile use gsm. most of the rest of the world uses gsm. - per google research.",False
ORD059619,ID6231506310,2019-07-24,Nickolson,"[('Candle Inferno', 1), ('Olivia x460', 2), ('Lucent 330S', 2)]",5340.0,59.6,-37.824404200000004,144.96895890000005,0,5399.6,Winter,True,0.6488,one star verizon said it was a stolen phone,False
ORD480632,ID0145246087,2019-09-23,Nickolson,"[('Alcon 10', 1), ('pearTV', 2)]",21570.0,61.57,-37.8161766,144.960877,0,21631.57,Spring,False,0.8089,one star pre paid phone,False
ORD076678,ID1236937911,2019-11-03,Thompson,"[('Alcon 10', 1), ('Lucent 330S', 2), ('Toshika 750', 2), ('Thunder line', 2)]",24410.0,84.36,-37.8262024,144.9492544,5,23273.86,Spring,False,1.5182,perfect! this was just what i wanted. the phone is solid and the package came new and unlocked as described. 100% satisfied!,True
ORD436845,ID1960476797,2019-12-02,Thompson,"[('Alcon 10', 1), ('iStream', 2), ('Thunder line', 2), ('Lucent 330S', 1)]",14840.0,70.24,-37.8173885,144.9526609,25,11200.24,Summer,False,0.7193,"this tablet is definitely recommended if you are looking for light to medium usage. tablet is snappy and quick but slarts to lag after installing multiple apps.digico app store is good but there are few essential apps that are not available, though you can install them using black market.",True
ORD181761,ID0313278255,2019-11-20,Nickolson,"[('iAssist Line', 1), ('Universe Note', 2), ('iStream', 2), ('pearTV', 1)]",15735.0,104.4,-37.8086441,144.9628946,0,15839.4,Spring,True,1.2529,works with cricket att really great phone works with cricket att,True
ORD280539,ID3215192362,2019-05-25,Thompson,"[('Universe Note', 2), ('pearTV', 2), ('Lucent 330S', 2)]",21980.0,78.44,-37.8093376,144.94912230000003,10,19860.44,Autumn,True,0.4129,good for the money you pay. great phone in general drains battery very fast,True
ORD451140,ID0576875477,2019-09-20,Nickolson,"[('Candle Inferno', 2), ('Thunder line', 1)]",3040.0,80.38975063456976,-37.8192916,144.9788269,15,2661.39,Spring,False,0.8194,"note 5 i wasn't sure about purchasing a refurbished cell ph, but am pleasantly surprised at this purchase. i don't have money to spend on the newest thing so waiting a few years pays off in my books. it looks close to new, features are working as expected. i am very happy with my purchase.",True
ORD449468,ID0477075431,2019-12-04,Nickolson,"[('Alcon 10', 1), ('Universe Note', 2), ('Lucent 330S', 2)]",18310.0,102.86,-37.8028102,144.96643480000003,15,15666.36,Summer,True,1.7784,"great products priced right never buy a new phone again, fast shipping product as advertised.",True
ORD260567,ID0247417570,2019-05-30,Nickolson,"[('pearTV', 1), ('Thunder line', 2), ('Universe Note', 1)]",14120.0,62.05,-37.817723799999996,144.9695717,5,13476.05,Autumn,False,0.09699999999999999,five stars good super,True
ORD138933,ID0746912557,2019-09-03,Nickolson,"[('Thunder line', 2), ('Toshika 750', 2), ('Candle Inferno', 2), ('pearTV', 2)]",26480.0,104.55,-37.8248451,144.98282609999995,25,19964.55,Spring,True,1.3589,"it works i love the phone, works great. haven't tried the fingerprint or face recognition. but love everything else.",True
ORD286997,ID0297631994,2019-01-14,Nickolson,"[('Toshika 750', 2), ('Universe Note', 2), ('Olivia x460', 1)]",16765.0,66.02,-37.826361999999996,144.9855522,25,12639.77,Summer,False,1.6514,"dont buy gold phone. gold ""paint"" worn off the home button. black underneath is showing through. looks terrible. dont buy gold.",False
ORD159755,ID1404221282,2019-01-09,Bakers,"[('Universe Note', 2), ('Thunder line', 2), ('Lucent 330S', 2), ('Candle Inferno', 2)]",14580.0,91.44,-37.80423320000001,144.9939455,15,12484.44,Summer,True,0.6514,"great phone works great, fast shipping, and quality phone for the price.",True
ORD301315,ID0131124746,2019-07-06,Nickolson,"[('Thunder line', 1), ('Candle Inferno', 2), ('iAssist Line', 1)]",5265.0,65.74,-37.814271399999996,144.9591922,0,5330.74,Winter,False,1.0303,five stars received it quickly works as well as the phone it replaced.,True
ORD159964,ID1725216525,2019-09-05,Thompson,"[('Toshika 750', 1), ('Alcon 10', 1), ('iStream', 1)]",13420.0,84.01,-37.802949299999995,144.96195519999995,0,13504.01,Spring,False,1.6987,looks promising to be a good product. still trying it out. looks promising to be a good product.,True
ORD246569,ID0299029626,2019-11-28,Bakers,"[('Thunder line', 1), ('iAssist Line', 2), ('Universe Note', 2)]",13530.0,102.5233572336857,-37.79921210000001,145.0052504,15,11605.83,Spring,True,1.4891,good phone i love my xp lumia. it was a bit tough to get used to at first but luckily my brother had the same phone for a while so he helped me. my mom also has this phone and she loves it too. it's a great phone! a bit pricey but worth it!,True
ORD010283,ID1889198841,2019-08-15,Nickolson,"[('Thunder line', 2), ('Olivia x460', 2), ('iAssist Line', 1)]",9035.0,72.83,-37.81922,144.96825,25,6849.08,Winter,True,0.1339,i enjoy this phone very much i enjoy this phone very much. i use the phone and i use word and excel to keep documents with me. i only wish microsoft was going to continue smartphone production and smartphone operating systems. i much prefer windows to android and ios operating systems.,True
ORD428195,ID0774566816,2019-12-27,Thompson,"[('pearTV', 2), ('Toshika 750', 1)]",16940.0,61.51,-37.805888,144.9561775,25,12766.51,Summer,False,1.101,review is based on the fact that i have not able to make a connection with the device.,False
ORD160570,ID0577519122,2019-02-26,Nickolson,"[('pearTV', 2), ('Alcon 10', 1), ('iAssist Line', 1)]",23795.0,71.04,-37.8221131,144.97401519999997,25,17917.29,Summer,False,0.5545,"great quality for price! this was my favorite phone that i've ever owned. i love all the features, but i wish the battery life was a little longer.",True
ORD459386,ID0591258553,2019-06-09,Thompson,"[('Olivia x460', 1), ('Thunder line', 2), ('iAssist Line', 2)]",10035.0,79.03,-37.823999900000004,144.9537655,15,8608.78,Winter,True,1.3916,reliable seller it’s all good.,True
ORD109161,ID0591430026,2019-05-15,Nickolson,"[('Universe Note', 1), ('Thunder line', 2)]",7810.0,48.07,-37.818345799999996,144.96413969999998,5,7467.57,Autumn,False,0.4767,garbage used refurbished phone was not new,False
ORD190857,ID2455254505,2019-10-07,Bakers,"[('Lucent 330S', 2), ('Thunder line', 2), ('Alcon 10', 1), ('Olivia x460', 1)]",16995.0,101.93,-37.7738026,144.98364660000001,5,16247.18,Spring,False,4.1559,i think this is the 5th one i've purchased. i'm working on getting one in every room of my house. i really like what features they offer specifily playing music on all thunders and controlling the lights throughout my house.,True
ORD427213,ID6226313838,2019-11-15,Nickolson,"[('Olivia x460', 1), ('Toshika 750', 1), ('iStream', 2)]",5845.0,103.29,-37.818636299999994,144.9827666,25,4487.04,Spring,True,1.1621,"good budget phone this phone is overall good if ur looking for something on a budget and have no use for nfc and u just want to play some casual games, this phone will get the job done💯",True
ORD334625,ID0589473177,2019-06-13,Nickolson,"[('Alcon 10', 2), ('iStream', 1), ('Candle Inferno', 1)]",18480.0,75.13,-37.819278999999995,144.9615442,0,18555.13,Winter,True,0.7082,"""great phone"" the smart phone is as advertise and i love it. thanks!",True
ORD264730,ID1449431194,2019-05-01,Nickolson,"[('Olivia x460', 1), ('Lucent 330S', 1), ('Alcon 10', 1)]",11405.0,77.24,-37.8135314,144.97406850000004,5,10911.99,Autumn,True,0.6896,great for audiobooks we got it for audio books from library and working well. very happy with it.,True
ORD179429,ID0312718930,2019-09-20,Thompson,"[('Candle Inferno', 2), ('Olivia x460', 1), ('pearTV', 1)]",8395.0,71.54,-37.801069,144.9638735,15,7207.29,Spring,False,1.9629,"do not buy the faulty refurbished product stopped working after just a few months. can no longer connect to wireless or bluetooth devices, nor can people hear me if it isn't on speaker",False
ORD406268,ID0368389679,2019-05-15,Nickolson,"[('iAssist Line', 2), ('Olivia x460', 1), ('Candle Inferno', 1), ('Thunder line', 1)]",8285.0,54.86,-37.8013167,144.97233830000005,10,7511.36,Autumn,False,1.9389,"don't purchase olivia universe s7 (renewed) i have had phone for only six months. worked well until now. it now drops calls and battery often runs low, even though i charge it nightly and only use phone to make a few calls or texts. would not purchase again.",False
ORD291374,ID1224804759,2019-08-08,Thompson,"[('Candle Inferno', 2), ('iStream', 1), ('Thunder line', 2), ('Olivia x460', 1)]",6595.0,61.74,-37.8132543,144.93868740000005,10,5997.24,Winter,True,0.7399,"do not buy 3 months after purchase, last week 'no service' shown on alcon , i contacted pear store and they sent my alcon to repair, i got it back yesterday ; alcon worked for a few hours, then 'no service' shown again, can't make call/receive a call; total waste!!!",False
ORD167915,ID0575387776,2019-12-26,Nickolson,"[('pearTV', 1), ('Candle Inferno', 1)]",6740.0,77.26,-37.8196346,144.98499569999996,5,6480.26,Summer,False,1.3631,five stars excellent really. it works perfect with all carriers in venezuela.,True
ORD188934,ID0777831467,2019-10-27,Thompson,"[('Olivia x460', 1), ('Toshika 750', 1)]",5545.0,89.91,-37.803950799999996,144.9580896,15,4803.16,Spring,True,1.3719,not factory sealed or unlocked by olivia this was not factory sealed and was not unlocked by olivia. there was a piece of shipping tape used to keep the box together.,False
ORD227722,ID5001030345,2019-05-05,Thompson,"[('Lucent 330S', 2), ('Thunder line', 2)]",6820.0,78.48,-37.8107806,144.95292080000004,25,5193.48,Autumn,True,0.5561,good upgrade from my note 5 personal use. just received 3 days prior and activated a day. have not had time to assess fingerprint reader.,True
ORD273522,ID4380043472,2019-06-02,Bakers,"[('Lucent 330S', 1), ('Toshika 750', 2), ('Thunder line', 2)]",14230.0,81.65,-37.8230514,144.98890680000005,15,12177.15,Winter,True,1.5561,five stars a good phone that could use an european adapter if we bill it as an international phone.,True
ORD246390,ID0575428924,2019-10-26,Nickolson,"[('Toshika 750', 1), ('Universe Note', 2), ('Lucent 330S', 2)]",13680.0,64.39,-37.8187066,144.98397240000003,5,13060.39,Spring,False,1.2682,"selling lost/stolen items i received this today, went to have it activated and it is showing as a lost/stolen phone.",False
ORD166635,ID0781093347,2019-09-05,Thompson,"[('Candle Inferno', 1), ('iAssist Line', 2), ('Alcon 10', 2), ('Universe Note', 1)]",26230.0,102.61,-37.8030545,144.94913390000005,10,23709.61,Spring,True,1.0859999999999999,"phone came in great condition, works perfectly like brand new bought this for my brother. phone came in great condition, works perfectly like brand new, battery life sustainable and he only has to charge once daily, camera works great, no scratches/dents/ cracks. is as exactly as described and more.",True
ORD005174,ID4716795162,2019-01-11,Thompson,"[('Alcon 10', 2), ('Universe Note', 2), ('Candle Inferno', 1), ('Toshika 750', 2)]",33870.0,94.43,-37.8189345,144.95309699999999,25,25496.93,Summer,True,0.8757,five stars excellent,True
ORD463689,ID0282825796,2019-02-18,Thompson,"[('Lucent 330S', 2), ('Universe Note', 1), ('Alcon 10', 1), ('iStream', 1)]",15010.0,96.49,-37.802035,144.9494307,25,11353.99,Summer,True,1.2023,good value it was returned it was locked,True
ORD074460,ID4520380524,2019-12-07,Thompson,"[('iAssist Line', 1), ('Candle Inferno', 2), ('iStream', 1)]",3235.0,93.56431362471008,-37.813657299999996,144.95728530000005,10,3005.28,Summer,True,0.9051,"great phone--truly ""like new"" condition phone was in perfect condition, can't tell it was used at all.",True
ORD140253,ID6197211593,2019-04-23,Thompson,"[('Toshika 750', 2), ('Universe Note', 1)]",12090.0,66.91,-37.8159474,144.9326379,10,10947.91,Autumn,True,1.3204,"piece of crap had to send it back; consistently failed to notify me of phone calls, texts, etc.",False
ORD333667,ID3240572175,2019-06-08,Thompson,"[('pearTV', 2), ('Olivia x460', 2)]",15070.0,65.87,-37.8057114,144.93090039999996,5,14382.37,Winter,True,1.6194,"phone was supposed to be factory unlocked, came locked with t-mobile i ordered a factory unlocked phone for a reason. i will update this review when they answer my request for a new phone unlocked per the offer and without t-mobile or any other provider apps on it.",False
ORD388020,ID3212024923,2019-06-24,Thompson,"[('Alcon 10', 2), ('iAssist Line', 2)]",22350.0,76.16,-37.8067771,144.9490393,25,16838.66,Winter,True,0.6788,i got this for my husband birthday and he loves it,True
ORD298984,ID1889485053,2019-07-23,Bakers,"[('Lucent 330S', 1), ('pearTV', 2), ('Universe Note', 1)]",17300.0,84.58,-37.8158343,145.04645,0,17384.58,Winter,True,4.5509,it's a scam this phone won't work on 4g in the us. they should have told me,False
ORD071403,ID0247028658,2019-09-15,Nickolson,"[('Thunder line', 2), ('Candle Inferno', 2), ('Toshika 750', 2)]",13860.0,98.85,-37.8156223,144.969886,10,12572.85,Spring,True,0.3322,"arrived today, excellent condition!! my phone came in the mail today, it's in amazing condition, you would never know it it used/refurbished. i'm very happy with my order! i set it up with metropcs and everything is going good!",True
ORD414227,ID0711333336,2019-02-26,Thompson,"[('Toshika 750', 1), ('Thunder line', 2), ('Olivia x460', 2)]",11130.0,79.16,-37.8070076,144.95789530000005,10,10096.16,Summer,True,1.1421,"not us phone - warranty will be void ** product is listed incorrectly! ** do not purchase ""new"" phone from this seller. it comes with a uk charger and manual for european countries. be weary of purchasing and just buying a replacement charger -- my research tells me that google will not accept the warranty in that case!!",False
ORD018083,ID0387152990,2019-11-18,Thompson,"[('Candle Inferno', 2), ('Lucent 330S', 1)]",2090.0,96.45,-37.810586,144.9501666,15,1872.95,Spring,True,0.358,"great phone, like new condition. works well. great phone. great condition. arrived on time. does not come with olivia charger or olivia box, but receives all updates. love my new phone. arrived sooner than promised.",True
ORD479474,ID4754200369,2019-11-29,Thompson,"[('Olivia x460', 1), ('iStream', 2), ('Lucent 330S', 2)]",3985.0,83.6,-37.815016899999996,144.9276057,0,4068.6,Spring,False,1.7314,good value this phone is good for the value. only complaint i have is receiving and making calls. sometimes inexplicably this phone just won't do it.,True
ORD231307,ID0448078443,2019-02-02,Bakers,"[('Olivia x460', 1), ('pearTV', 2), ('iStream', 2), ('Thunder line', 1)]",16325.0,99.52,-37.7993846,144.985002,0,16424.52,Summer,True,1.4849,"pear alcon xs screen too small for my liking pear alcon xs is a great phone and the seller kept his side of the deal. however, when i received the phone, i was not impressed due to the small screen size. i have shipped it back through ups; and ordered pear alcon xs max, 6.5"", 512gb instead.",True
ORD070321,ID1879206769,2019-04-28,Thompson,"[('Alcon 10', 1), ('Thunder line', 2), ('Olivia x460', 1)]",14535.0,69.97,-37.80055150000001,144.9608591,5,13878.22,Autumn,False,1.8143,highly recommend very happy with phone and the customer service. will definitely purchase another phone when needed.,True
ORD459449,ID0245507511,2019-12-22,Thompson,"[('iStream', 1), ('iAssist Line', 1), ('pearTV', 1)]",8685.0,104.53,-37.7988615,144.9578438,15,7486.78,Summer,True,1.8061,it’s really unlocked to any carrier still in love with this phone💜💜,True
ORD463233,ID5630513724,2019-12-04,Thompson,"[('Thunder line', 1), ('Alcon 10', 2)]",20080.0,73.2,-37.817384600000004,144.95267230000005,5,19149.2,Summer,False,0.7196,"five stars best phone i have ever had, so responsive, takes excellent pictures and super resilient(dropped from 10 ft no damage)",True
ORD216641,ID5424203728,2019-08-12,Nickolson,"[('Universe Note', 2), ('pearTV', 2), ('Lucent 330S', 2)]",21980.0,64.79,-37.8190083,144.9770033,15,18747.79,Winter,False,0.6569,no crack screen phone was unlocked with no carrier i was so nervous to purchase this phone off here now that i got it’s been working really goood had for a month now still waiting for it to act up it hasn’t hopefully it doesn’t but for as of now i love it,True
ORD013543,ID3208518281,2019-12-24,Nickolson,"[('Lucent 330S', 1), ('pearTV', 2)]",13850.0,101.88,-37.8035651,144.9672031,10,12566.88,Summer,True,1.6858,five stars great phone near perfect! no scratches and the speaker works amazing!,True
ORD015408,ID0306383398,2019-11-13,Thompson,"[('pearTV', 1), ('Lucent 330S', 2), ('iStream', 1)]",8920.0,60.76,-37.8058946,144.9413997,0,8980.76,Spring,False,0.9044,two stars phone doesn't keep charge it get hot when your using it,False
ORD329618,ID3222703099,2019-01-01,Thompson,"[('iStream', 1), ('pearTV', 2), ('Toshika 750', 1)]",17090.0,63.3,-37.801877399999995,144.9461521,0,17153.3,Summer,False,1.2045,one star did not work. was connected to an account already,False
ORD109183,ID1560149506,2019-02-01,Thompson,"[('Toshika 750', 2), ('Candle Inferno', 1), ('Alcon 10', 1), ('Olivia x460', 1)]",19245.0,79.43,-37.8158975,144.9372575,5,18362.18,Summer,True,0.9345,liars!! liars!!! cellphone doesn't work with all operators and they don't want back my money.,False
ORD443251,ID4754200409,2019-12-27,Thompson,"[('pearTV', 1), ('Alcon 10', 1), ('Olivia x460', 2), ('iStream', 2)]",18010.0,102.51,-37.8169526,144.9274736,15,15411.01,Summer,True,1.7878,olivia universe s4 great. performance is like monster. .it works more than my expectations. i was about to buy tab but dropped thr idea after getting this. ..,True
ORD390375,ID0591212213,2019-10-18,Nickolson,"[('Alcon 10', 2), ('Olivia x460', 2)]",20350.0,80.51,-37.822894399999996,144.9556604,25,15343.01,Spring,False,1.3119,"great for reading in the sunlight. as well as light, and easy on the wrist. great product, but a little speedy.",True
ORD040082,ID6167344541,2019-10-11,Nickolson,"[('iStream', 1), ('Universe Note', 2), ('pearTV', 1)]",13360.0,78.0,-37.81026170000001,144.9695829,0,13438.0,Spring,False,0.9276,great phone great memory. fast.,True
ORD318137,ID0282854772,2019-01-08,Bakers,"[('Alcon 10', 1), ('pearTV', 1), ('Olivia x460', 1), ('Lucent 330S', 2)]",18945.0,82.57,-37.800225,145.00961,10,17133.07,Summer,False,1.6680000000000001,"works great this is a great phone, takes fantastic pics, operates very smooth. it was an at*t phone, am using it on tmobile and it was unlocked as claimed by the seller, have run the oreo update without any issues! would definitely buy from them again.",True
ORD276326,ID4283908181,2019-04-22,Bakers,"[('Olivia x460', 2), ('pearTV', 1)]",8760.0,82.22,-37.8114192,145.0097679,5,8404.22,Autumn,True,1.2881,"big, beautiful and sleek i love my phone- it's been a few days with it, and it's a little bigger than comfortable but i love it very much. very high quality, beautiful and sleek.",True
ORD021623,ID0462141852,2019-04-27,Nickolson,"[('iStream', 2), ('Toshika 750', 2), ('pearTV', 1), ('Universe Note', 2)]",22150.0,81.97076197011793,-37.8240961,144.9603545,0,22229.05,Autumn,True,1.0144,great price nice phone for the great price! love it,True
ORD162822,ID3394725163,2019-03-04,Nickolson,"[('iStream', 1), ('Thunder line', 2)]",4510.0,79.22,-37.8177544,144.95910130000001,0,4589.22,Autumn,True,0.9237,four stars really like the phone but battery drains quickly.,True
ORD498162,ID0767726007,2019-09-23,Nickolson,"[('Candle Inferno', 2), ('Lucent 330S', 1), ('Olivia x460', 1), ('Thunder line', 2)]",7675.0,109.54,-37.803343299999995,144.9695607,15,6633.29,Spring,True,1.6978,awesome phone! great phone! after the updates it doesn't heat up as bad and the battery lasts a lot longer! i will always buy a toshika phone after using this one for sure!,True
ORD337785,ID6167489420,2019-12-29,Thompson,"[('Olivia x460', 2), ('Lucent 330S', 1), ('iStream', 2), ('iAssist Line', 1)]",6205.0,75.4,-37.810925299999994,144.95900790000005,15,5349.65,Summer,False,1.0678,item as described and delivered on time.  thank you,True
ORD014914,ID0847531521,2019-08-03,Nickolson,"[('Olivia x460', 2), ('Candle Inferno', 1), ('iStream', 2), ('pearTV', 1)]",9490.0,76.62485627151422,-37.8208282,144.9680865,5,9090.66,Winter,True,0.28,"this is a good phone, easy to use this is a good phone, easy to use. the only fault i find is that it does not give the option to group numbers, enter email addresses nor home addresses. if a person has more than one phone numbers they have to be entered individually.",True
ORD129447,ID0593476101,2019-08-26,Nickolson,"[('Olivia x460', 2), ('pearTV', 1), ('Lucent 330S', 1), ('Universe Note', 1)]",13440.0,77.64,-37.8101553,144.9638469,0,13517.64,Winter,True,1.065,great phone great phone for anyone who hates spending almost a grand on alcon or other top of the line phone. love it. way better than g4.,True
ORD213347,ID0709973337,2019-11-18,Thompson,"[('iStream', 1), ('Thunder line', 1)]",2330.0,62.65,-37.8148086,144.9357019,15,2043.15,Spring,False,1.0275,phone doesn't work the internal antenna was broke and would not receive service. had to take it to pear to be looked at only to have to buy a new phone to have a working phone. not worth it.,False
ORD437832,ID5648622173,2019-01-19,Thompson,"[('Universe Note', 2), ('Alcon 10', 2), ('iAssist Line', 1), ('Thunder line', 2)]",31385.0,68.62,-37.80026420000001,144.9635872,15,26745.87,Summer,False,2.0047,one star had the phone for less than a week and it doesn't work anymore because of hardware issues,False
ORD227156,ID6167413244,2019-09-14,Nickolson,"[('Olivia x460', 2), ('Alcon 10', 1)]",11400.0,100.19,-37.8117448,144.972083,25,8650.19,Spring,True,0.7944,great phone for me great phone for me. almost glad i had some bad phones(except the money). now i know what i want in a phone and this is it.,True
