order_id,customer_id,date,nearest_warehouse,shopping_cart,order_price,delivery_charges,customer_lat,customer_long,coupon_discount,order_total,season,is_expedited_delivery,distance_to_nearest_warehouse,latest_customer_review,is_happy_customer
ORD008936,ID2207661092,2019-02-13,Thompson,"[('Lucent 330S', 2), ('pearTV', 2), ('iAssist Line', 2), ('Alcon 10', 1)]",28480.0,76.79,-37.8018117,144.9456606,10,25708.79,Summer,False,1.2154,nice packaging :d mine came in a droid razr maxx hd case. 10/10,True
ORD295947,ID5424203842,2019-02-28,Nickolson,"[('iStream', 1), ('Universe Note', 2), ('Toshika 750', 1), ('iAssist Line', 2)]",15820.0,60.35,-37.8228795,144.9806268,25,11925.35,Summer,False,1.0844,"loud speaker is very bad.. even for the price, quality is not that good..",False
ORD183324,ID1985546060,2019-08-03,Nickolson,"[('Candle Inferno', 1), ('pearTV', 1), ('Thunder line', 2)]",11100.0,71.35,-37.803309399999996,144.9649319,5,10616.35,Winter,False,1.7494,excellent value for $$ works perfectly. i bought a new one on digico a couple of years ago. still going strong. bought this one as a gift. still happy!,True
ORD252686,ID3132495216,2019-03-28,Nickolson,"[('Thunder line', 2), ('Toshika 750', 2), ('pearTV', 2), ('Universe Note', 2)]",32520.0,64.74,-37.8148411,144.96479240000005,10,29332.74,Autumn,False,0.5914,"nice, too good for a very cheap price nice, too good for a very cheap price, there are some little problem though but over all, i love it!",True
ORD134026,ID0702364052,2019-06-07,Thompson,"[('pearTV', 2), ('Alcon 10', 2), ('Olivia x460', 1), ('Lucent 330S', 2)]",34205.0,66.47,-37.8054348,144.9411825,15,29140.72,Winter,False,0.9577,software update glitch the product looks brand new. everthing works well. i had a little issues with the texting but was able to figure it out. but now my only complaint is that as soon as i did my software update. it keeps on giving me notifications. how do i make it stop? anyone can help.,True
ORD454207,ID2188399793,2019-11-11,Nickolson,"[('Lucent 330S', 2), ('Thunder line', 2), ('Alcon 10', 2)]",24720.0,100.67,-37.8121085,144.97048049999995,15,21112.67,Spring,True,0.7267,great phone this is a awesome phone it's very nice looking and it's not to big. i'm using straighttalk at&t and it runs on lte great and with the android 7.0 update it performs awesome. coming from a alcon 5s this is much better.,True
ORD345239,ID0767750983,2019-06-09,Nickolson,"[('Thunder line', 1), ('iAssist Line', 1), ('iStream', 1)]",4555.0,71.29,-37.80082210000001,144.97229119999997,5,4398.54,Winter,False,1.9931,five stars love the phone slow at times but turning off keeping apps logged off seems to be doing the job,True
ORD074368,ID2383211225,2019-03-24,Nickolson,"[('Lucent 330S', 2), ('Alcon 10', 2), ('Olivia x460', 2)]",22810.0,64.11,-37.813525299999995,144.9655983,0,22874.11,Autumn,False,0.6628,value for money amazing phone for the price. can be a little slow when multiple apps open so the key is keep only one or two open at a time.,True
ORD432125,ID0283334348,2019-06-17,Thompson,"[('pearTV', 2), ('Lucent 330S', 1)]",13850.0,68.4,-37.7994961,144.9491927,25,10455.9,Winter,False,1.4787,?=#stew proof i like it,True
ORD098657,ID0580186868,2019-12-13,Thompson,"[('pearTV', 1), ('Lucent 330S', 1)]",7540.0,84.11,-37.800275,144.92935590000005,10,6870.11,Summer,False,2.0813,"we got 2 of these tablets in black friday for a great price! its a pro if you have digico gold, since everything around this tablet is digico base- shopping, videos, books, and iassist.",True
ORD168319,ID3281122855,2019-06-25,Thompson,"[('Lucent 330S', 2), ('Thunder line', 1), ('iAssist Line', 2), ('Candle Inferno', 2)]",9950.0,66.74,-37.8051664,144.95761240000004,0,10016.74,Winter,False,1.2482,five stars nice deal,True
ORD297910,ID0021579158,2019-02-27,Nickolson,"[('Candle Inferno', 2), ('Universe Note', 2)]",7760.0,94.2,-37.8190933,144.9787206,15,6690.2,Summer,True,0.8082,"the s3 was well better. the camera takes forever to focus on it the s3 was well better. the camera takes forever to focus on it. next, the sounds is not so great.",True
ORD484431,ID0157850295,2019-08-26,Nickolson,"[('Universe Note', 2), ('pearTV', 1), ('iStream', 1), ('Alcon 10', 2)]",31260.0,61.77,-37.8194451,144.97172709999995,10,28195.77,Winter,False,0.2135,easy installation and set up. better sound from the thunder line smart speaker. very satisified with purchase.,True
ORD454108,ID6206966468,2019-06-21,Thompson,"[('Toshika 750', 1), ('iAssist Line', 1), ('Candle Inferno', 1), ('iStream', 2)]",7275.0,80.06,-37.804349,144.93419440000002,15,6263.81,Winter,True,1.4631,"four stars stylish and classy, still trying to learn how to operate some of the features.",True
ORD280084,ID3790949321,2019-10-13,Thompson,"[('pearTV', 2), ('Lucent 330S', 1)]",13850.0,64.58,-37.8053164,144.937245,0,13914.58,Spring,False,1.1904,wont charge wont come on after buying new battery phone did not come on did not show charging wont charge wont come on ordered new battery still nothing,False
ORD095159,ID0547586409,2019-02-07,Bakers,"[('Universe Note', 1), ('Alcon 10', 2), ('Toshika 750', 2), ('iStream', 2)]",30290.0,73.43,-37.813541,144.98507030000005,0,30363.43,Summer,False,0.9769,nice,True
ORD062610,ID0282825846,2019-01-06,Thompson,"[('Universe Note', 1), ('pearTV', 2), ('Lucent 330S', 1)]",17300.0,77.78,-37.8018337,144.9514251,5,16512.78,Summer,False,1.266,and it is a great phone! i was so worried about buying a used phone! but it came with no scratches! and it is a great phone!!! thank you digico,True
ORD240222,ID4005718490,2019-12-20,Bakers,"[('Thunder line', 1), ('Candle Inferno', 1), ('pearTV', 1)]",8920.0,96.2,-37.8203196,144.9894131,5,8570.2,Summer,True,1.258,i love it!  i especially love that it is so small and does so much.  got rid of my old cd/alarm clock radio.  much more room on nightstand.,True
ORD104562,ID6167191731,2019-11-29,Nickolson,"[('Olivia x460', 2), ('Lucent 330S', 2)]",4910.0,97.82,-37.81567379999999,144.9663184,5,4762.32,Spring,True,0.4319,the phones are in great condition when i received them the phones are in great condition when i received them. i have only setup one and there was no issue at all. we use these phones for our drivers and can pretty much beat up but it's a good phone.,True
ORD398246,ID2642814904,2019-03-15,Thompson,"[('Toshika 750', 1), ('Thunder line', 1), ('iAssist Line', 2), ('pearTV', 1)]",17260.0,50.11,-37.8214747,144.9444227,25,12995.11,Autumn,False,1.0070000000000001,two stars used phone stopped working 1/3/2017. will cost $200 to repair. buyer beware!,False
ORD228019,ID0847529568,2019-12-08,Nickolson,"[('Olivia x460', 2), ('Universe Note', 1), ('Candle Inferno', 2), ('Alcon 10', 2)]",24660.0,76.66,-37.823708,144.9672747,5,23503.66,Summer,True,0.6033,durability is zero of it falls screen first it fell once from a table indoors and the screen cracked and blacked out and never came back on.,False
ORD360403,ID0253027648,2019-10-13,Thompson,"[('Universe Note', 2), ('Thunder line', 2), ('iAssist Line', 1)]",13485.0,80.06,-37.824154799999995,144.94391230000005,5,12890.81,Spring,False,1.3079,alcons everything about the phone works good. love the storage too 128gb is worth,True
ORD222184,ID0233314824,2019-11-04,Nickolson,"[('Universe Note', 1), ('Olivia x460', 1)]",4675.0,106.34,-37.8054251,144.9744624,0,4781.34,Spring,True,1.5283,perfecto trabaja excelente,True
ORD044431,ID0310944071,2019-01-14,Bakers,"[('Lucent 330S', 2), ('pearTV', 1), ('Toshika 750', 2), ('Thunder line', 1)]",19590.0,81.52,-37.803765399999996,145.00566740000005,5,18692.02,Summer,True,1.1504,not happy at all with this phone pretty s***ty phone. its hard to program and you cant change the time on it. overall you get what you pay for i guess,False
ORD390430,ID0836066530,2019-08-29,Thompson,"[('Candle Inferno', 2), ('Lucent 330S', 1), ('pearTV', 1), ('Thunder line', 1)]",10580.0,80.66021882268328,-37.820783,144.94864730000003,15,9069.92,Winter,True,0.9134,my daughter just loved this candle inferno. she said it was the perfect gift that she could receive.,True
ORD174874,ID0582798802,2019-08-22,Nickolson,"[('Alcon 10', 1), ('Olivia x460', 2), ('Universe Note', 2), ('iAssist Line', 1)]",20525.0,52.63,-37.82357879999999,144.98048899999995,5,19551.38,Winter,False,1.1103,first fall of less than 2 feet and the ink ... first fall of less than 2 feet and the ink in the screen leaked!!!!!! this was the second day of owning it. had phone in past that took many falls and this never happened. last time ever purchasing a refurbished phone. no one stands behind product from screen protector to refurbiser.,False
ORD425064,ID0847531131,2019-03-21,Nickolson,"[('Candle Inferno', 1), ('iAssist Line', 2), ('iStream', 1), ('Lucent 330S', 1)]",6260.0,63.37,-37.8222097,144.9678411,0,6323.37,Autumn,False,0.4296,"excellent phone all ok, thanks",True
ORD051723,ID5424203777,2019-10-11,Nickolson,"[('Universe Note', 1), ('pearTV', 2), ('Lucent 330S', 1), ('Candle Inferno', 2)]",18160.0,102.55,-37.8223304,144.9782491,5,17354.55,Spring,True,0.8706,all i wanted was a candle to read books. i got this instead!! excellent choice because i can read books and do so much more!!,True
ORD105728,ID3218227009,2019-07-05,Thompson,"[('Olivia x460', 1), ('Thunder line', 2), ('iAssist Line', 2)]",10035.0,79.5676001338208,-37.8060592,144.9460326,15,8605.25,Winter,True,0.7419,"needed a prepaid verizon phone for a bit. worked ... needed a prepaid verizon phone for a bit. worked well, nearly stock android, and i was able to root and unlock the bootloader after going through a middle man through xda. look up the info there.",True
ORD024078,ID0588190422,2019-06-19,Nickolson,"[('Lucent 330S', 2), ('pearTV', 2)]",15080.0,47.85,-37.81518320000001,144.9713804,0,15127.85,Winter,False,0.4125,"don't count on having battery when you need it. battery life is terrible! i was lucky if i got 6 hours of battery life with little to no use, and with the battery saver mode on and all apps turned off in the background. beautiful phone, great display and camera, but not enough to make up for the terrible battery life.",False
ORD286185,ID4735909090,2019-09-14,Thompson,"[('Universe Note', 1), ('pearTV', 2)]",16070.0,78.16,-37.804114500000004,144.9495843,0,16148.16,Spring,False,0.9781,great phone for the price! this is a great phone for the price so far.,True
ORD432515,ID0576832873,2019-03-07,Bakers,"[('Olivia x460', 2), ('iStream', 2), ('Toshika 750', 2), ('Thunder line', 2)]",15750.0,50.23,-37.8174308,144.9878354,0,15800.23,Autumn,False,1.0526,"one star it says ""a verizon phone"" but doesn't work with verizon . don't buy it . basically rip off",False
ORD484194,ID2187770705,2019-02-25,Nickolson,"[('pearTV', 1), ('Universe Note', 2), ('Alcon 10', 2), ('Lucent 330S', 1)]",32340.0,77.45,-37.8090866,144.9635351,15,27566.45,Summer,False,1.1833,neat tool we enjoy it with the family,True
ORD409847,ID0202519512,2019-06-25,Thompson,"[('Alcon 10', 2), ('iStream', 2)]",18200.0,89.1,-37.80162979999999,144.9211476,0,18289.1,Winter,True,2.5901,"really happy with this product great bang for your buck! no problems with it, got here when it said it would!",True
ORD184123,ID1449298228,2019-07-14,Nickolson,"[('iAssist Line', 1), ('Toshika 750', 2), ('iStream', 1)]",11015.0,79.88,-37.818763,144.9836536,10,9993.38,Winter,True,1.2403,best value phone best value phone...,True
ORD010988,ID5058108339,2019-06-12,Nickolson,"[('pearTV', 1), ('Thunder line', 1), ('iAssist Line', 1)]",10715.0,47.72,-37.82250560000001,144.9692865,10,9691.22,Winter,False,0.4359,pos wouldn't keep a steady reliable signal. 2 days of diagnostics and trouble shooting with att and we tried everything. switched back to my s5.,False
ORD167864,ID1842169016,2019-06-21,Nickolson,"[('Toshika 750', 1), ('Lucent 330S', 2), ('Alcon 10', 1), ('Thunder line', 2)]",20090.0,66.95729625255693,-37.832570399999994,144.97168380000005,0,20162.15,Winter,False,1.567,like new phone came looking and working like it was brand new. it was fully unlocked and wiped. no issues getting it set up. battery life is as expected. no scratches. camera works great.,True
ORD472487,ID0581783899,2019-04-14,Thompson,"[('iAssist Line', 2), ('Lucent 330S', 1)]",5680.0,48.52,-37.808660100000004,144.94197490000005,25,4308.52,Autumn,False,0.6327,one star used not new and it was an unlock at&t phone,False
ORD090383,ID0401505830,2019-01-10,Bakers,"[('Candle Inferno', 1), ('iStream', 2)]",730.0,80.36,-37.7991571,144.98622609999995,5,773.86,Summer,False,1.4433,storage.... plenty for pictures and videos i completely love my phone! great camera very easy to use and for the price i was able to get a phone with all the features at a price i could afford.,True
ORD013819,ID0164063160,2019-01-16,Thompson,"[('iStream', 1), ('pearTV', 2), ('Thunder line', 1)]",14950.0,72.02,-37.8149599,144.9546275,15,12779.52,Summer,False,0.7118,"as described! great phone purchased for my daughter. as described, mint condition, no problems.",True
ORD222734,ID0607606103,2019-12-30,Nickolson,"[('iAssist Line', 2), ('Lucent 330S', 2), ('Thunder line', 1)]",9090.0,92.58,-37.8126315,144.9650456,15,7819.08,Summer,True,0.7731,better than antcipated all the bells & whistles for half the price of a “new” one. came with a screen protector on it & 98% battery health. couldn’t have done better anywhere. completely unlocked & ready to rock. faceid works flawlessly & so did everything else- as advertised.,True
ORD202780,ID0827019327,2019-11-10,Thompson,"[('pearTV', 2), ('Candle Inferno', 2)]",13480.0,101.71,-37.8179614,144.950781,0,13581.71,Spring,True,0.6731,five stars yes,True
ORD192826,ID1833110304,2019-12-29,Nickolson,"[('Alcon 10', 1), ('Toshika 750', 2), ('iAssist Line', 1), ('Thunder line', 2)]",24175.0,72.08,-37.8197944,144.9590356,15,20620.83,Summer,False,0.9343,love it! it's everything i wanted and more,True
ORD178171,ID5002595006,2019-07-21,Thompson,"[('Universe Note', 2), ('Candle Inferno', 2), ('Alcon 10', 1), ('Thunder line', 2)]",21070.0,58.61,-37.812772499999994,144.9516406,5,20075.11,Winter,True,0.4022,"no funciona, la pantalla esta negra gracias el tel dejo de funcionar , no tiene ni dos meses ustedes pueden ver este caso , soy de argentina y voy a estar en miami hasta el lunes hoy se lo puedo mandar . gracias",False
ORD054328,ID0591435152,2019-01-30,Nickolson,"[('pearTV', 2), ('Alcon 10', 1), ('iStream', 2)]",21870.0,88.48,-37.8176868,144.9692503,10,19771.48,Summer,True,0.1045,i love it i love it. the phone is a little to big to go into your pants pocket but the phone is a good size to see or to hold in your hands.,True
ORD435906,ID4520380532,2019-01-12,Thompson,"[('iAssist Line', 1), ('Candle Inferno', 1), ('iStream', 1), ('Toshika 750', 2)]",11445.0,80.89,-37.8157078,144.95823090000005,15,9809.14,Summer,True,1.0381,"what a joke. phone speaker does not work. i can't make phone calls. won't charge now either. this is unreal, i just bought this less than a week ago. so disappointed",False
ORD012865,ID4804855255,2019-06-06,Thompson,"[('Universe Note', 2), ('iStream', 1), ('Candle Inferno', 2), ('Alcon 10', 2)]",25810.0,54.79,-37.7989805,144.9454345,15,21993.29,Winter,False,1.531,"no charger??, my phone did not come with charger or any other accessory why????",False
ORD420222,ID3106293380,2019-12-25,Thompson,"[('iStream', 1), ('Thunder line', 2), ('Candle Inferno', 1)]",4940.0,98.65,-37.8065586,144.93250600000005,5,4791.65,Summer,True,1.4504,excellent colors of the screen and speed of the processer is better than expected,True
ORD347736,ID3146808071,2019-07-07,Bakers,"[('Olivia x460', 2), ('iAssist Line', 2)]",6900.0,65.16,-37.8118976,144.9866869,0,6965.16,Winter,False,0.7807,"good deal!! best prepaid phone, hands down! really fast and very capable of anything.",True
ORD232786,ID0588191345,2019-09-17,Nickolson,"[('Toshika 750', 1), ('iStream', 1), ('Universe Note', 2)]",11370.0,60.76,-37.814231899999996,144.9728163,25,8588.26,Spring,False,0.5642,the volume is very low,False
ORD406203,ID6167191692,2019-02-04,Thompson,"[('Lucent 330S', 1), ('iAssist Line', 1), ('Thunder line', 1)]",5635.0,74.82,-37.81874439999999,144.9548791,5,5428.07,Summer,False,0.9636,thank you digico! i love the white version of the alcon. this works great!,True
ORD324327,ID6167440989,2019-06-06,Nickolson,"[('Toshika 750', 2), ('Universe Note', 1)]",12090.0,65.45,-37.8132791,144.96256430000003,5,11550.95,Winter,False,0.853,easy and manuabable out of this world....olivia products.....the best.,True
ORD222974,ID3222703101,2019-10-12,Thompson,"[('Universe Note', 2), ('iStream', 1), ('pearTV', 1)]",13360.0,107.88,-37.8002006,144.9463261,15,11463.88,Spring,True,1.3899,"fantastic value! i had some concerns about my purchase given some of the reviews, but i cannot say anything negative about the product or my experience. fantastic value and a flawless product.",True
ORD083115,ID0332796830,2019-05-10,Bakers,"[('Lucent 330S', 2), ('Universe Note', 1), ('Candle Inferno', 2), ('pearTV', 2)]",19390.0,60.966088500252326,-37.8075831,145.00031940000005,0,19453.83,Autumn,False,0.5219,"amazing battery life, not really for playing games. i like the phone but if you like to play games on your phone then they will need to be lower graphics.",True
ORD089579,ID0145235381,2019-10-24,Nickolson,"[('Alcon 10', 1), ('Olivia x460', 2), ('Candle Inferno', 2)]",12260.0,77.12,-37.8164539,144.9592888,25,9272.12,Spring,False,0.9334,awesome phone i would recommend to anyone i have owned a lot of cell phones some olivia some others and i have to say the universe a10 is the best phone i've ever ordered,True
ORD331665,ID0207085166,2019-08-21,Bakers,"[('iAssist Line', 1), ('Candle Inferno', 1)]",2655.0,54.15245922208388,-37.8179067,145.01449519999997,5,2579.46,Winter,False,1.9092,max battery capacity: 77% i didn’t realize until it was too late that the maximum battery capacity is 77%,False
ORD034355,ID3218227002,2019-10-13,Thompson,"[('Thunder line', 2), ('pearTV', 1)]",10670.0,99.39,-37.8066411,144.9460875,15,9168.89,Spring,True,0.677,excellence! best dang phone i've ever had! :),True
ORD363171,ID0588191344,2019-03-21,Nickolson,"[('Olivia x460', 1), ('iAssist Line', 1)]",3450.0,63.89,-37.8142023,144.9729142,0,3513.89,Autumn,False,0.5715,phone good all ok,True
ORD027621,ID2279153650,2019-10-31,Nickolson,"[('pearTV', 1), ('Alcon 10', 1), ('Universe Note', 1), ('Thunder line', 2)]",23070.0,76.67,-37.8124295,144.9742773,5,21993.17,Spring,False,0.8024,will buy again. this phone is great for the money it's rugged and holds up to physical abuse. i brought one for my daughter. the screen cracked and still works perfect. the battery is ok just take long to charge...,True
ORD048929,ID1681675853,2019-04-30,Nickolson,"[('iAssist Line', 1), ('Lucent 330S', 1), ('Universe Note', 2), ('Candle Inferno', 2)]",11215.0,65.58,-37.8098238,144.976572,15,9598.33,Autumn,False,1.1552,fun and reliable. good quality for the money. easy to use.,True
ORD106565,ID4735909080,2019-11-08,Thompson,"[('pearTV', 2), ('Olivia x460', 1), ('Thunder line', 1)]",16025.0,100.68,-37.8042599,144.9495596,10,14523.18,Spring,True,0.9618,wow i expected the phone to come in garbage condition or have some sort of virus. the phone has worked flawlessly since my purchase. the battery life is outstanding. the longest battery life i've ever gotten out of a phone. 10/10 would by again.,True
ORD056697,ID0767733192,2019-09-19,Nickolson,"[('iStream', 1), ('Olivia x460', 1), ('Universe Note', 1), ('pearTV', 1)]",11135.0,85.4419175165986,-37.8042104,144.9717005,0,11216.71,Spring,False,1.6124,very happy with my new phone everything came as advertised. very happy with my new phone.,True
ORD399566,ID0060096860,2019-01-21,Nickolson,"[('iAssist Line', 1), ('Alcon 10', 2), ('Universe Note', 1), ('pearTV', 2)]",36195.0,73.37,-37.8184834,144.972258,5,34458.62,Summer,True,0.2384,"buyer beware i got this phone for verizon and it was beautiful, but i'm suspicious about it, because it would have horrible reception i many places. i had it next to a note 3 and the note 5 barely worked. this made it unusable. i have returned it.",False
ORD290954,ID3810637356,2019-05-18,Thompson,"[('iAssist Line', 2), ('Lucent 330S', 2), ('Alcon 10', 1)]",15860.0,65.85,-37.8214474,144.9444435,10,14339.85,Autumn,False,1.0036,"she hasn't used the it yet, but my son did a quick check and it seems just fine.",True
ORD068608,ID4353912800,2019-08-11,Bakers,"[('Olivia x460', 2), ('Universe Note', 2), ('Lucent 330S', 2)]",11810.0,59.98,-37.8250773,145.01499980000003,0,11869.98,Winter,False,2.4166,won't charge product came faulty and does not charge. says is has a warranty but is impossible to utilize.,False
ORD014456,ID1492145801,2019-01-18,Thompson,"[('Universe Note', 2), ('Alcon 10', 1), ('Toshika 750', 2)]",24490.0,89.12,-37.8125749,144.95113669999995,0,24579.12,Summer,True,0.3579,excellent purchase very happy with my purchase. phone was in amazing condition! works perfectly so far,True
ORD057849,ID3215192014,2019-04-15,Thompson,"[('iAssist Line', 2), ('Universe Note', 2)]",11350.0,77.89,-37.808112,144.9509394,0,11427.89,Autumn,True,0.6113,"love this phone! it got here faster than they said it would, which made me very happy, and i love this phone! i have yet to find anything i don't like about it. i switched from the lg optimus l9 from metro pcs, and while that was a decent phone, i like this one so much better!",True
ORD197280,ID0477077882,2019-01-27,Nickolson,"[('pearTV', 1), ('Toshika 750', 1), ('Universe Note', 1), ('Lucent 330S', 2)]",16540.0,97.99,-37.807482,144.9758132,10,14983.99,Summer,True,1.3541,"good phone exactly as described. and exactly what i was looking for. though i do see what one reviewer was talking about with ""pocket pictures"". the camera on switch is a little too promenant.",True
ORD425631,ID0060089303,2019-06-12,Nickolson,"[('Thunder line', 2), ('Olivia x460', 1), ('Toshika 750', 2)]",14225.0,83.79,-37.8242364,144.98728269999995,15,12175.04,Winter,True,1.6809,toshika es lo mejor excelente teléfono único y original,True
ORD062659,ID2771805040,2019-10-30,Nickolson,"[('Candle Inferno', 1), ('Universe Note', 2)]",7330.0,99.08,-37.8142456,144.9744632,25,5596.58,Spring,True,0.6489,"awesome product loved it until i took a swim with it, bought a note 8 to replace so all's well that ends well",True
ORD007205,ID5002595117,2019-08-08,Thompson,"[('pearTV', 2), ('Universe Note', 2)]",19520.0,74.81,-37.812123799999995,144.9534288,10,17642.81,Winter,True,0.5626,"the best cell phone in the market.. loving this cell phone, it does everything and more what i'm asking on cell phone. ..thats all i can say about this photo",True
ORD181920,ID0266739935,2019-04-07,Bakers,"[('Candle Inferno', 2), ('Lucent 330S', 2), ('pearTV', 1)]",9630.0,81.94,-37.822551000000004,144.9938715,15,8267.44,Autumn,True,1.4027,"this phone is a serious competition to alcons. after first saying that this phone cannot work in my region, it ""changed its mind"" and it works very well, a serious competition to alcons! i recommend this phone to anyone looking for a new one.",True
ORD176178,ID1492150970,2019-03-16,Thompson,"[('iStream', 1), ('Toshika 750', 1), ('Candle Inferno', 2), ('Alcon 10', 1)]",14280.0,63.41,-37.8150883,144.95233530000004,10,12915.41,Autumn,False,0.5355,"great, but missed a few things! take great pics. videos sent to others comes out wobbly. there's no earbud connection????",True
ORD385323,ID0600744903,2019-02-04,Nickolson,"[('iAssist Line', 1), ('pearTV', 1)]",8535.0,74.23,-37.811723,144.96525559999995,0,8609.23,Summer,False,0.8532,purchased this for myself and am just beginning to learn all that it can do.  so far am very pleased and amazed at the different actions it can perform.  am enjoying it and looking forward to learning more about other options it provides.,True
ORD214847,ID0664378904,2019-01-07,Nickolson,"[('Toshika 750', 2), ('Lucent 330S', 2)]",11100.0,88.21,-37.8204902,144.9661112,15,9523.21,Summer,True,0.3688,five stars best phone i've ever had,True
ORD043474,ID0575472970,2019-03-30,Nickolson,"[('Olivia x460', 2), ('pearTV', 2), ('Candle Inferno', 1), ('Universe Note', 1)]",18950.0,51.33,-37.8197639,144.9814256,0,19001.33,Autumn,False,1.0523,two stars this phone doesn't have good service like the olivia universe s 2 i had,False
ORD204001,ID0781114190,2019-05-10,Thompson,"[('pearTV', 1), ('iStream', 2), ('iAssist Line', 1), ('Alcon 10', 1)]",17785.0,67.53,-37.8031877,144.95030769999997,10,16074.03,Autumn,False,1.0936,"one of my best purchases, for the price really good phone one of my best purchases, for the price really good phone... just be aware that it doesnt have flash, good camara but without flash",True
ORD286656,ID0580171936,2019-10-06,Thompson,"[('Lucent 330S', 1), ('Olivia x460', 1), ('Candle Inferno', 1), ('Universe Note', 2)]",9785.0,82.88,-37.8019203,144.93431759999999,0,9867.88,Spring,False,1.6403,"good phone, good price so far, so good, have only had it for a short time.",True
ORD287226,ID0777835311,2019-01-12,Thompson,"[('Olivia x460', 2), ('Universe Note', 2), ('Lucent 330S', 1)]",10580.0,97.33018480247456,-37.801930299999995,144.9572928,25,8035.51,Summer,True,1.4962,included charger does not work in us the phone is really nice. i don't have any complains to the phone. however the charger included is for somewhere else. it does not fit in the power outlet in us. so i have to use my existing charger instead.,True
ORD279575,ID2632208068,2019-03-31,Bakers,"[('Olivia x460', 1), ('Lucent 330S', 1), ('Universe Note', 2)]",9355.0,66.26,-37.819355,144.9895766,15,8018.01,Autumn,False,1.1544,"the casing needs to be imroved. i did not like the metallic casing otherwise, all other things are nice",True
ORD065304,ID1404221278,2019-11-10,Bakers,"[('iStream', 2), ('Universe Note', 1), ('Alcon 10', 2)]",21650.0,64.78041945344212,-37.8035213,144.9948772,5,20627.21,Spring,False,0.7214,junk alcon phone won't acces internet digico help center fed me b.s. for an hour. totally worthless purchase,False
